{
  "id": "b9c0d1e2-f3a4-4b5c-9d6e-7f8a9b0c1d2e",
  "topic": {
    "section": "READING",
    "domain": "Information_and_Ideas",
    "subtopic": "command_of_evidence"
  },
  "difficulty": {
    "overall": 3,
    "conceptual": 3.3,
    "procedural": 2.8,
    "linguistic": 3.2
  },
  "passage": "The following passage is adapted from a 2022 study on deep-sea mining and ecosystem impacts.\n\nProposals to mine polymetallic nodules from the deep ocean floor have attracted interest from technology companies and governments seeking alternative sources of cobalt, nickel, and manganese — metals critical for battery production. Environmental scientists, however, have raised serious concerns about the ecological consequences of such extraction.\n\nPolymetallic nodule fields are home to remarkably high species diversity. A survey of the Clarion-Clipperton Zone in the Pacific Ocean — a prime target for commercial mining — recorded 822 distinct invertebrate species in nodule habitats, of which approximately 92% were previously unknown to science. Many of these organisms are sessile, meaning they live attached to nodule surfaces and cannot relocate when disturbed.\n\nSediment plumes generated by mining equipment pose a significant threat beyond the immediate extraction zone. When a single test collector vehicle operated in the Peru Basin in 1989, it generated a sediment plume that spread over 3,600 square kilometers within two weeks. Researchers revisiting the site 26 years later found that organism density in the disturbed area remained 30% lower than in undisturbed reference areas, indicating recovery had not occurred over that timespan.\n\nSome proponents of deep-sea mining argue that the nodule fields are sufficiently remote and extensive that small extraction zones would leave the broader ecosystem intact. A 2020 modeling study, however, projected that commercial-scale mining operations covering just 1% of the Clarion-Clipperton Zone would eliminate habitat for an estimated 600 species, based on the high endemism — restriction to particular localities — of nodule-associated fauna.\n\nMarine biologists note that deep-sea recovery rates are inherently slower than in shallower ecosystems, given lower temperatures, reduced energy input from the surface, and the multi-millennial timescales over which nodules themselves form.",
  "passageMetadata": {
    "genre": "scientific",
    "wordCount": 284,
    "source": "Adapted from a 2022 environmental science review article"
  },
  "stem": "An environmental scientist contends that damage from a single past mining test in the deep ocean has persisted for decades without meaningful ecological recovery. Which evidence from the passage most directly supports this contention?",
  "choices": [
    {
      "label": "A",
      "text": "\"A survey of the Clarion-Clipperton Zone in the Pacific Ocean recorded 822 distinct invertebrate species in nodule habitats, of which approximately 92% were previously unknown to science.\"",
      "isCorrect": false
    },
    {
      "label": "B",
      "text": "\"When a single test collector vehicle operated in the Peru Basin in 1989, it generated a sediment plume that spread over 3,600 square kilometers within two weeks.\"",
      "isCorrect": false
    },
    {
      "label": "C",
      "text": "\"Researchers revisiting the site 26 years later found that organism density in the disturbed area remained 30% lower than in undisturbed reference areas, indicating recovery had not occurred over that timespan.\"",
      "isCorrect": true
    },
    {
      "label": "D",
      "text": "\"commercial-scale mining operations covering just 1% of the Clarion-Clipperton Zone would eliminate habitat for an estimated 600 species, based on the high endemism of nodule-associated fauna\"",
      "isCorrect": false
    }
  ],
  "correctAnswer": "C",
  "explanation": "The claim specifies two elements: (1) the damage comes from a single past mining test, and (2) it has persisted for decades without meaningful recovery. Choice C directly addresses both elements. It identifies a return visit 26 years after the original disturbance, reports that organism density remained 30% lower than undisturbed reference areas (establishing persistence), and explicitly states 'indicating recovery had not occurred over that timespan' (directly addressing the 'without meaningful recovery' element). Only one inferential step connects 'remained 30% lower' with 'without meaningful recovery,' and the passage supplies that connection explicitly. Choice B is a strong distractor because it is about the same single test event, but it addresses the extent of the plume at the time — not whether recovery occurred afterward.",
  "distractorRationale": {
    "A": "Choice A documents species diversity in nodule habitats but provides no evidence about past mining tests or ecological recovery. It supports the ecological value of nodule fields, not the persistence of mining damage.",
    "B": "Choice B concerns the same single 1989 test event referenced in the claim and provides specific data (3,600 km² plume spread), making it a plausible distractor. However, it describes the immediate extent of damage, not whether recovery occurred decades later. It does not address persistence over time.",
    "C": "This is the correct answer. See explanation above.",
    "D": "Choice D provides quantified future projections (600 species eliminated) for commercial-scale operations, not evidence about past tests or actual observed recovery. It addresses projected large-scale harm rather than documented persistent damage from a single historical event."
  },
  "metadata": {
    "generatedAt": "2026-02-20T00:00:00.000Z",
    "promptVersion": "1.5.0",
    "modelUsed": "claude-sonnet-4-6",
    "generationId": "c0d1e2f3-a4b5-4c6d-8e7f-9a0b1c2d3e4f"
  }
}
