{
  "id": "a3f2e8d1-9c4b-4e7a-8f2d-1b5c6a9d3e7f",
  "topic": {
    "section": "READING",
    "domain": "Craft_and_Structure",
    "subtopic": "cross_text_connections"
  },
  "difficulty": {
    "overall": 1,
    "conceptual": 1,
    "procedural": 1.3,
    "linguistic": 1.3
  },
  "stem": "Based on the texts, how would Rodriguez (Text 2) most likely respond to Chen's findings (Text 1)?",
  "choices": [
    {
      "label": "A",
      "text": "He would suggest that her research supports his conclusion about the importance of environmental conditions during early butterfly development.",
      "isCorrect": true
    },
    {
      "label": "B",
      "text": "He would argue that her focus on survival rates overlooks the significance of wing structure quality.",
      "isCorrect": false
    },
    {
      "label": "C",
      "text": "He would question whether sheltered environments actually benefit butterflies in the long term.",
      "isCorrect": false
    },
    {
      "label": "D",
      "text": "He would point out that wing inflation occurs independently of the predator exposure she describes.",
      "isCorrect": false
    }
  ],
  "correctAnswer": "A",
  "explanation": "Both texts describe research showing that protected environments during the post-emergence period benefit butterflies. Chen found that sheltered spaces increase survival rates, while Rodriguez found that calm environments improve wing development and flight efficiency. Rodriguez would likely view Chen's findings as complementary evidence supporting the broader principle that environmental stability matters during this critical developmental window. Both researchers reach aligned conclusions about the value of protected conditions, making this a supportive relationship.",
  "distractorRationale": {
    "A": "This is the correct answer.",
    "B": "This incorrectly suggests disagreement. Rodriguez's focus on wing structure doesn't contradict Chen's focus on survival rates; rather, they examine different but compatible benefits of the same environmental conditions.",
    "C": "This mischaracterizes Rodriguez's position. His research demonstrates that sheltered environments do provide long-term benefits (improved flight efficiency and lifespan), so he would not question this approach.",
    "D": "This is incorrect because Rodriguez's text doesn't suggest wing inflation is independent of environmental factors. In fact, he explicitly states that environmental stability affects wing development, which aligns with rather than contradicts Chen's emphasis on environmental protection."
  },
  "metadata": {
    "generatedAt": "2026-01-09T21:37:51.858Z",
    "promptVersion": "1.3.0",
    "modelUsed": "claude-sonnet-4-5-20250929",
    "generationId": "48978294-17ac-4cb8-811f-b0b5efee1672"
  },
  "passage": "Text 1\n\nMany people assume that butterflies emerge from their chrysalises knowing how to fly immediately. Research by biologist Sarah Chen shows that newly emerged butterflies actually spend several hours pumping fluid into their wings and practicing wing movements before attempting flight. During this period, the insects remain vulnerable to predators and weather conditions. Chen's observations of over 200 monarch butterflies revealed that those given sheltered spaces during this critical window had significantly higher survival rates than those exposed to wind and rain.\n\nText 2\n\nThe first hours after a butterfly leaves its chrysalis represent a crucial developmental stage. During this time, the butterfly's wings expand and harden through a process called wing inflation, where hemolymph fluid fills the wing veins. Entomologist Marcus Rodriguez documented that butterflies kept in calm, protected environments during wing inflation showed stronger, more symmetrical wing development. His study found that environmental stability during this phase directly correlates with the butterfly's later flight efficiency and overall lifespan.",
  "passageMetadata": {
    "genre": "informational",
    "wordCount": 186,
    "source": "Original scientific passages"
  },
  "hasImage": false
}