{
  "id": "78d1f5b3-29c6-4a50-b837-4e9c0d2f6a81",
  "topic": {
    "section": "READING",
    "domain": "Standard_English_Conventions",
    "subtopic": "boundaries"
  },
  "difficulty": {
    "overall": 1,
    "conceptual": 1.3,
    "procedural": 1,
    "linguistic": 1.2
  },
  "passage": "Virginia Woolf transformed the modern novel with her innovative narrative techniques. She pioneered stream-of-consciousness writing; a method that captures the fluid, associative nature of human thought. Her novels Mrs. Dalloway and To the Lighthouse remain landmarks of twentieth-century literature.",
  "passageMetadata": {
    "genre": "informational",
    "wordCount": 52,
    "source": "Original passage for SAT practice"
  },
  "stem": "Which choice best maintains sentence boundaries?",
  "choices": [
    {
      "label": "A",
      "text": "NO CHANGE",
      "isCorrect": false
    },
    {
      "label": "B",
      "text": ", a method that captures",
      "isCorrect": true
    },
    {
      "label": "C",
      "text": ". A method that captures",
      "isCorrect": false
    },
    {
      "label": "D",
      "text": "; and a method that captures",
      "isCorrect": false
    }
  ],
  "correctAnswer": "B",
  "explanation": "The phrase 'a method that captures the fluid, associative nature of human thought' is an appositive — a noun phrase that renames and explains 'stream-of-consciousness writing.' Appositives must be set off with a comma, not a semicolon. A semicolon is reserved for joining two independent clauses, but 'a method that captures...' is not an independent clause (it has no subject-verb pair functioning as a main clause). Choice B correctly uses a comma to attach the appositive to the preceding independent clause.",
  "distractorRationale": {
    "A": "NO CHANGE incorrectly uses a semicolon before an appositive phrase. Semicolons must join two independent clauses, but 'a method that captures the fluid, associative nature of human thought' is a noun phrase, not an independent clause. Placing a semicolon here violates Standard English punctuation rules.",
    "C": "Placing a period before 'A method that captures...' creates a fragment. The resulting 'sentence' — 'A method that captures the fluid, associative nature of human thought' — has no main verb and cannot stand alone as a complete sentence.",
    "D": "A semicolon followed by 'and' before a phrase (not an independent clause) compounds the error. The right side, 'a method that captures...,' is not an independent clause, so neither a semicolon nor a conjunction is appropriate here; a comma is required to introduce the appositive."
  },
  "metadata": {
    "generatedAt": "2026-02-20T00:00:00.000Z",
    "promptVersion": "1.5.0",
    "modelUsed": "claude-sonnet-4-6",
    "generationId": "3a6e9c5d-1f48-4b72-8d20-7c4b1e9f5a26"
  },
  "hasImage": false
}
